{
  "schema_version": "1.0",
  "session_id": "11111111-1111-4111-8111-111111111111",
  "seq": 13,
  "command_id": "22222222-2222-4222-8222-222222222222",
  "action": "consume.eat",
  "status": "succeeded",
  "reason_code": "POSTCONDITION_MET",
  "timestamp_ms": 1770000009000,
  "started_at_ms": 1770000002000,
  "finished_at_ms": 1770000009000,
  "attempt": 1,
  "progress": 1.0,
  "message": "Еда съедена",
  "evidence": {
    "hunger_before": 0.42,
    "hunger_after": 0.27,
    "item_ref_missing_after": true
  },
  "diagnostics": []
}
